{
  "goal": {
    "description": "Turn hello_world into a web app proving the per-runtime Bridge principle (blueprint/2-RULES.md Bridge/Bridge Core/Bridge Adapter glossary, R4 Local/Worker/Remote taxonomy): a Python backend (unchanged capabilities) plus a new web.serve capability exposing it over sample/schemas/bridge-protocol.schema.json, and a genuine JavaScript frontend Bridge whose OWN greeting.render capability runs Local and depends on backend's console.write via executor_kind: remote -- two independently-owned contracts (backend/implementation/contracts/, frontend/implementation/contracts/), never a shared one, referenced across the boundary only by capability ID (R4)."
  },
  "starting_state": "sample/hello_world",
  "decisions": [
    {
      "responsibility": "console_write",
      "decision": "reuse",
      "reason": "'console_write' already implemented and registered; unchanged by this cycle."
    },
    {
      "responsibility": "greeting_compose",
      "decision": "reuse",
      "reason": "'greeting_compose' already implemented and registered; unchanged by this cycle."
    },
    {
      "responsibility": "console_write_legacy",
      "decision": "reuse",
      "reason": "'console_write_legacy' already implemented and registered; unchanged by this cycle."
    },
    {
      "responsibility": "greeting_compose_process",
      "decision": "reuse",
      "reason": "'greeting_compose_process' already implemented and registered; unchanged by this cycle."
    },
    {
      "responsibility": "console_write_process",
      "decision": "reuse",
      "reason": "'console_write_process' already implemented and registered; unchanged by this cycle."
    },
    {
      "responsibility": "web.serve",
      "decision": "create",
      "reason": "Nothing exposed the backend Bridge over a network boundary; needed so a different runtime's own Bridge Adapter (the frontend's) can reach it as executor_kind: remote (R4)."
    },
    {
      "responsibility": "greeting.render (frontend)",
      "decision": "create",
      "reason": "Frontend's own capability, not a second implementation of backend's greeting.compose -- a real app's frontend-facing and backend-facing shapes rarely turn out identical, so this one has its own contract (frontend/implementation/contracts/greeting.render.contract.yaml) and its own output shape (returns the composed text for display), while still depending on backend's console.write by ID (R4), proving a specific capability can run Local in one runtime while composing a dependency that only exists Remote from it."
    }
  ],
  "new_capabilities": [
    "web.serve",
    "greeting.render (frontend/runtime/capabilities/greeting/render)"
  ],
  "reused_capabilities": [
    "console_write",
    "greeting_compose",
    "console_write_legacy",
    "greeting_compose_process",
    "console_write_process"
  ],
  "bridge_integration": "Backend: every call above resolved through app/requests.py's single request-construction point and the same canonical Bridge app/main.py uses (R6/R8). Frontend: greeting_render resolved through frontend/runtime/app.js's own Bridge Adapter and Bridge Core (frontend/runtime/bridge/core.js), whose console.write dependency (declared by ID, not by sharing backend's contract) resolved as executor_kind: remote to the SAME backend Bridge over web.serve's /bridge endpoint -- every observed trace, in both runtimes, reached executed.",
  "verification": {
    "harness": "sample/hello_world/backend/implementation/tests/verify/verify.py",
    "verification_record_ref": "sample/hello_world/backend/state/verification-record.json",
    "status": "verified"
  },
  "resulting_state": "sample/hello_world",
  "next_cycle_readiness": "capability-catalog.jsonl, dependencies.yaml, and this verification record are everything the next cycle needs; no private memory of this run is required."
}